email_id,comment_id,comment_code,comment_body,previous_comment_id,previous_comment_code,previous_comment_body,concat_body
35,631053015,uncivil,I'm surprised no one complained about Microsoft's use of the name `core`,631051737,uncivil,"Unless you _actually_ work for the companies involved, your opinion is probably negligible here.","Unless you _actually_ work for the companies involved, your opinion is probably negligible here. I'm surprised no one complained about Microsoft's use of the name `core`"
35,631054804,uncivil,What I do see is a bunch of people who want to complain but probably never have used Xamarin and probably never will use Maui regardless of what it's called.,631054456,technical,"Maybe because ""Core"" is not a marketed Microsoft product name, but a component of a marketed product named "".NET""? There is Qt Core, and somehow Qt Core and .NET Core don't read as similar as ""MAUI"" and ""MAUI"" do.","Maybe because ""Core"" is not a marketed Microsoft product name, but a component of a marketed product named "".NET""? There is Qt Core, and somehow Qt Core and .NET Core don't read as similar as ""MAUI"" and ""MAUI"" do. What I do see is a bunch of people who want to complain but probably never have used Xamarin and probably never will use Maui regardless of what it's called."
35,631056651,uncivil,Beautiful! You steal name and say that it's OK! Good position!,631056170,technical,"Hi all, the official legal name is .NET Multi-platform App UI and MAUI is an acronym, code name. This has been through legal review.  I don't believe this is the forum for this discussion. If there are ongoing concerns, please email me and we can loop in the appropriate teams.","Hi all, the official legal name is .NET Multi-platform App UI and MAUI is an acronym, code name. This has been through legal review.  I don't believe this is the forum for this discussion. If there are ongoing concerns, please email me and we can loop in the appropriate teams. Beautiful! You steal name and say that it's OK! Good position!"
35,631057060,uncivil,"... not sure if you expect us all to email you now, but please be prepared...",631056976,technical,"I don't believe this is not the forum for this discussion. If there are ongoing concerns, please email me and we can loop in the appropriate teams.  If you don't believe this is not the forum, why close issue?","I don't believe this is not the forum for this discussion. If there are ongoing concerns, please email me and we can loop in the appropriate teams.  If you don't believe this is not the forum, why close issue? ... not sure if you expect us all to email you now, but please be prepared..."
35,631231404,uncivil,Its OK to be passionate but attacking another open source project for any reason is not okay.,631070338,technical,"In addition to all the other problems ""MAUI"" is not google/bing-able... it brings up the island. ""Xamarin Forms"" is, ""DotNetUI"" would be, ""MAUI"", not so much.","In addition to all the other problems ""MAUI"" is not google/bing-able... it brings up the island. ""Xamarin Forms"" is, ""DotNetUI"" would be, ""MAUI"", not so much. Its OK to be passionate but attacking another open source project for any reason is not okay."
35,631231404,uncivil,This is not the kind of community we want to have and such behavior will not be tolerated.,631070338,technical,"In addition to all the other problems ""MAUI"" is not google/bing-able... it brings up the island. ""Xamarin Forms"" is, ""DotNetUI"" would be, ""MAUI"", not so much.","In addition to all the other problems ""MAUI"" is not google/bing-able... it brings up the island. ""Xamarin Forms"" is, ""DotNetUI"" would be, ""MAUI"", not so much. This is not the kind of community we want to have and such behavior will not be tolerated."
36095,365265517,uncivil,Using sexual abusive language is not the way to express your opinion.,365264756,technical,Akasurde I don't see how offensive title makes it less of an issue. The code in the issue seems self-descriptive to several people in this thread. Do you really need any additional feedback from issue author?,Akasurde I don't see how offensive title makes it less of an issue. The code in the issue seems self-descriptive to several people in this thread. Do you really need any additional feedback from issue author? Using sexual abusive language is not the way to express your opinion.
36095,365267898,uncivil,Your assumption about that it's self-descriptiveness is only _partially_ correct when you refer to several ppl you mentioned.,365265797,technical,Please refer Code of Conduct for more details.,Please refer Code of Conduct for more details. Your assumption about that it's self-descriptiveness is only _partially_ correct when you refer to several ppl you mentioned.
36095,365267898,uncivil,"I myself try avoiding to assume that other people see and understand things exactly the same way as me, because every individual has their own unique experience. That said I encourage you to not make such assumptions here.",365265797,technical,Please refer Code of Conduct for more details.,"Please refer Code of Conduct for more details. I myself try avoiding to assume that other people see and understand things exactly the same way as me, because every individual has their own unique experience. That said I encourage you to not make such assumptions here."
37113,716059373,uncivil,You give false impression to others.,716057171,civil,"My sincere apologies.  I was in the wrong, and I've done you harm.  I'm sorry.","My sincere apologies.  I was in the wrong, and I've done you harm.  I'm sorry. You give false impression to others."
37113,716063997,uncivil,"Brian should argue his case from a position of hands on, mature knowledge rather than having us collect that for him and demanding his proposal be accepted unmodified and that none of us is in a better position than to test and evaluate the suitability of including the proposal of porting `canonicalize` unmodified into the go standard library for Windows than he himself and the company he works for.",716060692,civil,"Alex, sorry, I had gathered that you're recognized as the principle Windows maintainer. I didn't mean to invent a title.","Alex, sorry, I had gathered that you're recognized as the principle Windows maintainer. I didn't mean to invent a title. Brian should argue his case from a position of hands on, mature knowledge rather than having us collect that for him and demanding his proposal be accepted unmodified and that none of us is in a better position than to test and evaluate the suitability of including the proposal of porting `canonicalize` unmodified into the go standard library for Windows than he himself and the company he works for."
37277,816918497,uncivil,You're incorrect,816917094,technical,"Which peer dep RFC are you referring to? (peer deps have always been semantically required, for example, but i'm not sure if that's what you're referring to)","Which peer dep RFC are you referring to? (peer deps have always been semantically required, for example, but i'm not sure if that's what you're referring to) You're incorrect"
37277,816918497,uncivil,I don't appreciate trying to have the last word on this argument after I told you I don't wish to debate it.,816917094,technical,"Which peer dep RFC are you referring to? (peer deps have always been semantically required, for example, but i'm not sure if that's what you're referring to)","Which peer dep RFC are you referring to? (peer deps have always been semantically required, for example, but i'm not sure if that's what you're referring to) I don't appreciate trying to have the last word on this argument after I told you I don't wish to debate it."
37277,817095735,uncivil,"Not only is your comment extremely insulting to the work my team is doing, you keep going and rambling we caAaAn't truUust theEem theEey're the deviIil in disguiIise"".""",817063151,technical,"It's not a misconception, it's how almost all software projects treat their dependencies. You will absolutely get issues filed to upgrade Yarn from users who will just assume that it's part of the plan.  Yarn 2 not being on the table today is not enough, it has to be explicitly off the table in the future. The harm to the ecosystem (and Node itself) is to great to invite in Yarn 1 as a trojan horse without such a commitment.","It's not a misconception, it's how almost all software projects treat their dependencies. You will absolutely get issues filed to upgrade Yarn from users who will just assume that it's part of the plan.  Yarn 2 not being on the table today is not enough, it has to be explicitly off the table in the future. The harm to the ecosystem (and Node itself) is to great to invite in Yarn 1 as a trojan horse without such a commitment. Not only is your comment extremely insulting to the work my team is doing, you keep going and rambling we caAaAn't truUust theEem theEey're the deviIil in disguiIise""."""
37277,817095735,uncivil,"I find this behavior ridiculous, entitled, and generally not up to the standard our community should strive for.",817063151,technical,"It's not a misconception, it's how almost all software projects treat their dependencies. You will absolutely get issues filed to upgrade Yarn from users who will just assume that it's part of the plan.  Yarn 2 not being on the table today is not enough, it has to be explicitly off the table in the future. The harm to the ecosystem (and Node itself) is to great to invite in Yarn 1 as a trojan horse without such a commitment.","It's not a misconception, it's how almost all software projects treat their dependencies. You will absolutely get issues filed to upgrade Yarn from users who will just assume that it's part of the plan.  Yarn 2 not being on the table today is not enough, it has to be explicitly off the table in the future. The harm to the ecosystem (and Node itself) is to great to invite in Yarn 1 as a trojan horse without such a commitment. I find this behavior ridiculous, entitled, and generally not up to the standard our community should strive for."
37277,819784707,uncivil,"Everyone who disagrees with me doesn't know what they are talking about""""",819747107,technical,"And this, folks, is the real reason why the same group of vocals in this issue (not everyone, mostly those who take care to upvote each other) is against this proposal.  Let's be honest - this isn't about maintenance. None of you even assessed the maintenance cost, or made proposals to decrease it. This isn't about Yarn 1 either - you neither use it, nor recommend it. This isn't about bugs - you'd otherwise be at arms about some other things we won't list here. This isn't about community - you certainly didn't talk to Yarn's users, nor even cared about their opinion. This isn't about Node - it should be fairly obvious that shipping a project owned by a for-profit as part of a free software is a major red flag and liability. This isn't about package management ecosystem - otherwise you'd listen to those actually writing those package managers (you may have missed it, but I'm not even the only one - another ghost is lurking this thread as well). This isn't whatever reason you want to make people believe it is, folks.  What this is is that you believe that modern npm is as good as Yarn, and you don't see how this proposal would do you any good. To you, Yarn should die a fiery death to give back npm all its glory, and you have many amazing ideas to make that happen. It's fine, we all have opinions. I'm more an Emacs user myself, but whatever. The problem is that this, quite literally, isn't the discussion at hand. Right here, right now, we're talking about the existing state of the ecosystem.  For the better or worse, whether you like it or not, Yarn is used. That's it. It's really not up to you (or me) to decide whether its users are right or wrong. The very fact that they use it means it matters. To block this proposal because, to you, ""npm is as good"" would be at best egoistical, at worst worrying meddling (not only would Node tolerate a for-profit project, it would actively fight for it, do you still want to laugh at Deno?). Frankly, the question really isn't ""should Node add Yarn"" - it's rather ""can Node prone inclusivity by persisting in providing a subpar developer experience to a specific set of people, depending on the tool they use?"".  As a side note, out of the 1000 most depended packages on the npm registry, 216 definitely use Yarn, and 291 use npm (the rest being undeterminable).","And this, folks, is the real reason why the same group of vocals in this issue (not everyone, mostly those who take care to upvote each other) is against this proposal.  Let's be honest - this isn't about maintenance. None of you even assessed the maintenance cost, or made proposals to decrease it. This isn't about Yarn 1 either - you neither use it, nor recommend it. This isn't about bugs - you'd otherwise be at arms about some other things we won't list here. This isn't about community - you certainly didn't talk to Yarn's users, nor even cared about their opinion. This isn't about Node - it should be fairly obvious that shipping a project owned by a for-profit as part of a free software is a major red flag and liability. This isn't about package management ecosystem - otherwise you'd listen to those actually writing those package managers (you may have missed it, but I'm not even the only one - another ghost is lurking this thread as well). This isn't whatever reason you want to make people believe it is, folks.  What this is is that you believe that modern npm is as good as Yarn, and you don't see how this proposal would do you any good. To you, Yarn should die a fiery death to give back npm all its glory, and you have many amazing ideas to make that happen. It's fine, we all have opinions. I'm more an Emacs user myself, but whatever. The problem is that this, quite literally, isn't the discussion at hand. Right here, right now, we're talking about the existing state of the ecosystem.  For the better or worse, whether you like it or not, Yarn is used. That's it. It's really not up to you (or me) to decide whether its users are right or wrong. The very fact that they use it means it matters. To block this proposal because, to you, ""npm is as good"" would be at best egoistical, at worst worrying meddling (not only would Node tolerate a for-profit project, it would actively fight for it, do you still want to laugh at Deno?). Frankly, the question really isn't ""should Node add Yarn"" - it's rather ""can Node prone inclusivity by persisting in providing a subpar developer experience to a specific set of people, depending on the tool they use?"".  As a side note, out of the 1000 most depended packages on the npm registry, 216 definitely use Yarn, and 291 use npm (the rest being undeterminable). Everyone who disagrees with me doesn't know what they are talking about"""""
37925,37925,uncivil,"Nice, the only notable contribution you've ever made anywhere on Github is making sure everyone at Google knows you're a racist.",653766613,technical,Note that varun-av only created the account to post this.,"Note that varun-av only created the account to post this. Nice, the only notable contribution you've ever made anywhere on Github is making sure everyone at Google knows you're a racist."
37771,650187983,uncivil,"BlackLivesMatter is not meant to be a racist statement, except you see it like this.",650173759,technical,"Where you see racism in #AllLivesMatter ? In my opinion #BlackLivesMatter is racist slogan against white people. Beside, why technology web page contains these things? It should contains angular related things only.","Where you see racism in #AllLivesMatter ? In my opinion #BlackLivesMatter is racist slogan against white people. Beside, why technology web page contains these things? It should contains angular related things only. BlackLivesMatter is not meant to be a racist statement, except you see it like this."
37771,650190816,uncivil,"So you need fix it in you county, and do not force your problems to all world!",650187983,uncivil,"BlackLivesMatter is not meant to be a racist statement, except you see it like this.","BlackLivesMatter is not meant to be a racist statement, except you see it like this. So you need fix it in you county, and do not force your problems to all world!"
37771,650190816,uncivil,"So you need fix it in you county, and do not force your problems to all world!",650187983,uncivil,Think about that.,"Think about that. So you need fix it in you county, and do not force your problems to all world!"
37771,650256067,uncivil,Anyway this issue will be closed without an answer since Google doesn't care about people but sticking to their narrative.,650200458,technical,"Only a short notice. We all together should be also very careful about the tendency, when one or the other side wants to win, even at any price and on any conditions, just the believing: ""We won in the end."" We have one proverb: Be careful not to spill the baby with the bath.","Only a short notice. We all together should be also very careful about the tendency, when one or the other side wants to win, even at any price and on any conditions, just the believing: ""We won in the end."" We have one proverb: Be careful not to spill the baby with the bath. Anyway this issue will be closed without an answer since Google doesn't care about people but sticking to their narrative."
37771,650256067,uncivil,Everyone here will be called a white supremacist antiblack antiasian antilgtbteq1324 and risking to be banned from the repo.,650200458,technical,"Only a short notice. We all together should be also very careful about the tendency, when one or the other side wants to win, even at any price and on any conditions, just the believing: ""We won in the end."" We have one proverb: Be careful not to spill the baby with the bath.","Only a short notice. We all together should be also very careful about the tendency, when one or the other side wants to win, even at any price and on any conditions, just the believing: ""We won in the end."" We have one proverb: Be careful not to spill the baby with the bath. Everyone here will be called a white supremacist antiblack antiasian antilgtbteq1324 and risking to be banned from the repo."
37771,650256067,uncivil,Welcome to 1984.,650200458,technical,"Only a short notice. We all together should be also very careful about the tendency, when one or the other side wants to win, even at any price and on any conditions, just the believing: ""We won in the end."" We have one proverb: Be careful not to spill the baby with the bath.","Only a short notice. We all together should be also very careful about the tendency, when one or the other side wants to win, even at any price and on any conditions, just the believing: ""We won in the end."" We have one proverb: Be careful not to spill the baby with the bath. Welcome to 1984."
37771,650263698,uncivil,"Nothing more cringey than tech framework sites posting about politics, even if you agree with the sentiment.",650256067,uncivil,Anyway this issue will be closed without an answer since Google doesn't care about people but sticking to their narrative.,"Anyway this issue will be closed without an answer since Google doesn't care about people but sticking to their narrative. Nothing more cringey than tech framework sites posting about politics, even if you agree with the sentiment."
37771,650263698,uncivil,"Nothing more cringey than tech framework sites posting about politics, even if you agree with the sentiment.",650256067,uncivil,Everyone here will be called a white supremacist antiblack antiasian antilgtbteq1324 and risking to be banned from the repo.,"Everyone here will be called a white supremacist antiblack antiasian antilgtbteq1324 and risking to be banned from the repo. Nothing more cringey than tech framework sites posting about politics, even if you agree with the sentiment."
37771,650263698,uncivil,"Nothing more cringey than tech framework sites posting about politics, even if you agree with the sentiment.",650256067,uncivil,Welcome to 1984.,"Welcome to 1984. Nothing more cringey than tech framework sites posting about politics, even if you agree with the sentiment."
37771,650263698,uncivil,"You know what, the white A"" in the Angular logo is all of a sudden making me feel uncomfortable...maybe even a little oppressed. Hmm, could the Angular team be racists??? Maybe we should make a separate issue to change the color to black.""",650256067,uncivil,Anyway this issue will be closed without an answer since Google doesn't care about people but sticking to their narrative.,"Anyway this issue will be closed without an answer since Google doesn't care about people but sticking to their narrative. You know what, the white A"" in the Angular logo is all of a sudden making me feel uncomfortable...maybe even a little oppressed. Hmm, could the Angular team be racists??? Maybe we should make a separate issue to change the color to black."""
37771,650263698,uncivil,"You know what, the white A"" in the Angular logo is all of a sudden making me feel uncomfortable...maybe even a little oppressed. Hmm, could the Angular team be racists??? Maybe we should make a separate issue to change the color to black.""",650256067,uncivil,Everyone here will be called a white supremacist antiblack antiasian antilgtbteq1324 and risking to be banned from the repo.,"Everyone here will be called a white supremacist antiblack antiasian antilgtbteq1324 and risking to be banned from the repo. You know what, the white A"" in the Angular logo is all of a sudden making me feel uncomfortable...maybe even a little oppressed. Hmm, could the Angular team be racists??? Maybe we should make a separate issue to change the color to black."""
37771,650263698,uncivil,"You know what, the white A"" in the Angular logo is all of a sudden making me feel uncomfortable...maybe even a little oppressed. Hmm, could the Angular team be racists??? Maybe we should make a separate issue to change the color to black.""",650256067,uncivil,Welcome to 1984.,"Welcome to 1984. You know what, the white A"" in the Angular logo is all of a sudden making me feel uncomfortable...maybe even a little oppressed. Hmm, could the Angular team be racists??? Maybe we should make a separate issue to change the color to black."""
37771,650263698,uncivil,Just noticed the #BlackLivesMatter banner on the home page for the first time...what a joke.,650256067,uncivil,Anyway this issue will be closed without an answer since Google doesn't care about people but sticking to their narrative.,Anyway this issue will be closed without an answer since Google doesn't care about people but sticking to their narrative. Just noticed the #BlackLivesMatter banner on the home page for the first time...what a joke.
37771,650263698,uncivil,Just noticed the #BlackLivesMatter banner on the home page for the first time...what a joke.,650256067,uncivil,Everyone here will be called a white supremacist antiblack antiasian antilgtbteq1324 and risking to be banned from the repo.,Everyone here will be called a white supremacist antiblack antiasian antilgtbteq1324 and risking to be banned from the repo. Just noticed the #BlackLivesMatter banner on the home page for the first time...what a joke.
37771,650263698,uncivil,Just noticed the #BlackLivesMatter banner on the home page for the first time...what a joke.,650256067,uncivil,Welcome to 1984.,Welcome to 1984. Just noticed the #BlackLivesMatter banner on the home page for the first time...what a joke.
37771,650263698,uncivil,Anyone have a list of other political movements endorsed by the Angular site?,650256067,uncivil,Anyway this issue will be closed without an answer since Google doesn't care about people but sticking to their narrative.,Anyway this issue will be closed without an answer since Google doesn't care about people but sticking to their narrative. Anyone have a list of other political movements endorsed by the Angular site?
37771,650263698,uncivil,Anyone have a list of other political movements endorsed by the Angular site?,650256067,uncivil,Everyone here will be called a white supremacist antiblack antiasian antilgtbteq1324 and risking to be banned from the repo.,Everyone here will be called a white supremacist antiblack antiasian antilgtbteq1324 and risking to be banned from the repo. Anyone have a list of other political movements endorsed by the Angular site?
37771,650263698,uncivil,Anyone have a list of other political movements endorsed by the Angular site?,650256067,uncivil,Welcome to 1984.,Welcome to 1984. Anyone have a list of other political movements endorsed by the Angular site?
37771,650276160,uncivil,What's racist about it? Also don't shame others based on their skills and development experience. That's against the code of conduct.,650271925,technical,"Silence is violence. It's important for business to get behind social causes to advance past the sins of humanity of the past. There is clearly a systemic discrimination toward the black community in the west. Of course all lives matter, but for all lives to matter you need to include black lives which clearly is not being represented equally","Silence is violence. It's important for business to get behind social causes to advance past the sins of humanity of the past. There is clearly a systemic discrimination toward the black community in the west. Of course all lives matter, but for all lives to matter you need to include black lives which clearly is not being represented equally What's racist about it? Also don't shame others based on their skills and development experience. That's against the code of conduct."
