email_id,comment_id,comment_code,comment_body,previous_comment_id,previous_comment_code,previous_comment_body,concat_body
1628,417059200,uncivil,So I fucked off and told them to eat shit.,417058635,technical,"I left the Lerna project a long time ago, I've gone as far as to replace Lerna with a new tool called Bolt. All technology is political, open source is especially political. It would not exist if not for political reasons. Open sourcing something is in itself a political act. We'll release it as major","I left the Lerna project a long time ago, I've gone as far as to replace Lerna with a new tool called Bolt. All technology is political, open source is especially political. It would not exist if not for political reasons. Open sourcing something is in itself a political act. We'll release it as major So I fucked off and told them to eat shit."
1628,417059200,uncivil,Once upon a time I thought I had to go work for those big corporations that I hate in order to do the kind of open source work I want to do. That turned out to be incredibly false. So I fucked off and told them to eat shit.,417058635,technical,"I left the Lerna project a long time ago, I've gone as far as to replace Lerna with a new tool called Bolt. All technology is political, open source is especially political. It would not exist if not for political reasons. Open sourcing something is in itself a political act. We'll release it as major","I left the Lerna project a long time ago, I've gone as far as to replace Lerna with a new tool called Bolt. All technology is political, open source is especially political. It would not exist if not for political reasons. Open sourcing something is in itself a political act. We'll release it as major Once upon a time I thought I had to go work for those big corporations that I hate in order to do the kind of open source work I want to do. That turned out to be incredibly false. So I fucked off and told them to eat shit."
1639,417381205,uncivil,"If you want to restrict who can use lerna, then lerna can no longer be called free, it will be proprietary.",417373249,technical,"Calls for ""civility"" and ""cooling down"" are invariably intended to cease discussion, not enhance it. Hannah's right - the time to discuss is now.","Calls for ""civility"" and ""cooling down"" are invariably intended to cease discussion, not enhance it. Hannah's right - the time to discuss is now. If you want to restrict who can use lerna, then lerna can no longer be called free, it will be proprietary."
1639,417404448,uncivil,"Calls for civility are perfectly apt after an issue like this. Suggesting that asking people to be nice"" is an attempt at ending discussion is one of the strangest stretches I've ever heard. As someone that called maintainers cowards for reverting the changes and removing Jamie, I can get a strong sense of why you'd argue that point, however.""",417387677,technical,"I see these as two separate issues. If the community and the maintainers want to use a modified MIT license, that is fully within their right. However, Jamie's behavior was plainly abusive and in violation of the CoC.","I see these as two separate issues. If the community and the maintainers want to use a modified MIT license, that is fully within their right. However, Jamie's behavior was plainly abusive and in violation of the CoC. Calls for civility are perfectly apt after an issue like this. Suggesting that asking people to be nice"" is an attempt at ending discussion is one of the strangest stretches I've ever heard. As someone that called maintainers cowards for reverting the changes and removing Jamie, I can get a strong sense of why you'd argue that point, however."""
1639,417450440,uncivil,"do you really want transparency, or are you looking for a fight?",417448135,technical,"your implication that commenters have no relation to Lerna is unsubstantiated. I for one am actively involved in the ecosystem surrounding Lerna and have been preparing to add Lerna to a project I maintain, although I am now considering alternative options.","your implication that commenters have no relation to Lerna is unsubstantiated. I for one am actively involved in the ecosystem surrounding Lerna and have been preparing to add Lerna to a project I maintain, although I am now considering alternative options. do you really want transparency, or are you looking for a fight?"
1639,417479261,uncivil,"If you're looking for rancorous sniping and harmful drama"" you might try using a mirror.""",417479254,technical,"this is transparently absurd. You can't just say ""I'm not influenced by the company who pays me"" and thus make it so. I sometimes laugh at the Twitter refrain of ""tech workers need to be trained in ethics,"" but perhaps it's true.","this is transparently absurd. You can't just say ""I'm not influenced by the company who pays me"" and thus make it so. I sometimes laugh at the Twitter refrain of ""tech workers need to be trained in ethics,"" but perhaps it's true. If you're looking for rancorous sniping and harmful drama"" you might try using a mirror."""
1639,417479641,uncivil,"Explain how me, the person who made the decision, not employed by Microsoft, was secretly paid by Microsoft to ruin open source. Should be an amusing story.",417479261,uncivil,"If you're looking for rancorous sniping and harmful drama"" you might try using a mirror.""","If you're looking for rancorous sniping and harmful drama"" you might try using a mirror."" Explain how me, the person who made the decision, not employed by Microsoft, was secretly paid by Microsoft to ruin open source. Should be an amusing story."
1639,417827484,uncivil,So for all this grandstanding you're doing -- why not delete your GitHub account...seriously -- MS will own GitHub soon. Also -- change your OS from Windows -- if you use that...,417827208,technical,"no I said for people who are against the change being reverted to look at the fact that they are using MS products -- which makes them hypocrites. If you want to boycott Microsoft, maybe don't use their products -- or even better get off of GitHub. I'm not even sure what you said -- to be honest I stopped reading it after the first sentence.","no I said for people who are against the change being reverted to look at the fact that they are using MS products -- which makes them hypocrites. If you want to boycott Microsoft, maybe don't use their products -- or even better get off of GitHub. I'm not even sure what you said -- to be honest I stopped reading it after the first sentence. So for all this grandstanding you're doing -- why not delete your GitHub account...seriously -- MS will own GitHub soon. Also -- change your OS from Windows -- if you use that..."
1639,417828353,uncivil,Oh Jesus nevermind -- I'm an idiot I guess :joy: -- apologies :),417827923,technical,"as I said perhaps he made some unfortunate statements - what I'm trying to say is that if you look at the license change PR where he elaborated, it does not look like he thinks he personally owns the project at the exclusion of anybody else. He did not push the change without review. When people say ""my"" thing, it can mean a lot of different things - its usually not helpful to draw strong conclusions from the use of that word.  Looking at the commit history, it does look like he was heavily involved in the early days of Lerna. I assume he means ""my"" in a similar sense - ""Lerna is a project which I was heavily involved in and I share significant responsibility for creating"".","as I said perhaps he made some unfortunate statements - what I'm trying to say is that if you look at the license change PR where he elaborated, it does not look like he thinks he personally owns the project at the exclusion of anybody else. He did not push the change without review. When people say ""my"" thing, it can mean a lot of different things - its usually not helpful to draw strong conclusions from the use of that word.  Looking at the commit history, it does look like he was heavily involved in the early days of Lerna. I assume he means ""my"" in a similar sense - ""Lerna is a project which I was heavily involved in and I share significant responsibility for creating"". Oh Jesus nevermind -- I'm an idiot I guess :joy: -- apologies :)"
1639,417830616,uncivil,"Sure, I'm sure you could argue Adolf was a pretty cool guy if you ignore all the other stuff he did and just focus on his gun control policy. ”¥",417829427,technical,"I would agree if this were the actual RFC thread, but this is actually just a thread requesting an RFC should exist in the first place. Therefore I don't think it's valid to judge peoples' comments here as what they would have said in an actual RFC.  And yet the reason we have OSS licenses as a staple of modern software development today was the continued preaching of outcast mailing list users in the last few decades, and you could extend this to basically any successful political protest as well. There's also lots of not OSS software that is free as in beer. And I appreciate that this is true, but being ""non-OSS"" would not preclude this from happening by default anyway.  And yet Stallman's own license is one of the most restrictive and closed-door OSS licenses there is. He just closes the door on a different group of people: the group of people that want to use or modify his code without sharing back their changes. There's not a fundamental difference between that and precluding groups for another reason. This is also why I think the OSI page on ""evil"", originated from the JSON license, is fairly crap. I think the ""do no evil line"" is also terrible because it's even less enforceable than what the MIT-ICE license was, but the discussion in OSS around being able to preclude wrongdoers from using code has been very backwards IMO.  As I said, Lerna's own license change is not meant to harm ICE by itself in any significant way, it's meant to  1. Deal with the ethical concerns of allowing a harmful entity to use your code 2. Show other OSS projects that this is a real dilemma and hopefully spark them to discuss and maybe take the same action  If many OSS projects do the same thing, then there could be real, large-scale change over time.  None of those show a trollish intent behind the action at all, and in the actual PR that was made, the changes were discussed in a very professional manner, all (at the time available) protocols were followed, and a calm and deliberate reasoning was given. Being terse and (arguably) rude to companies over their using tools he contributed to does not constitute the action being trollish.","I would agree if this were the actual RFC thread, but this is actually just a thread requesting an RFC should exist in the first place. Therefore I don't think it's valid to judge peoples' comments here as what they would have said in an actual RFC.  And yet the reason we have OSS licenses as a staple of modern software development today was the continued preaching of outcast mailing list users in the last few decades, and you could extend this to basically any successful political protest as well. There's also lots of not OSS software that is free as in beer. And I appreciate that this is true, but being ""non-OSS"" would not preclude this from happening by default anyway.  And yet Stallman's own license is one of the most restrictive and closed-door OSS licenses there is. He just closes the door on a different group of people: the group of people that want to use or modify his code without sharing back their changes. There's not a fundamental difference between that and precluding groups for another reason. This is also why I think the OSI page on ""evil"", originated from the JSON license, is fairly crap. I think the ""do no evil line"" is also terrible because it's even less enforceable than what the MIT-ICE license was, but the discussion in OSS around being able to preclude wrongdoers from using code has been very backwards IMO.  As I said, Lerna's own license change is not meant to harm ICE by itself in any significant way, it's meant to  1. Deal with the ethical concerns of allowing a harmful entity to use your code 2. Show other OSS projects that this is a real dilemma and hopefully spark them to discuss and maybe take the same action  If many OSS projects do the same thing, then there could be real, large-scale change over time.  None of those show a trollish intent behind the action at all, and in the actual PR that was made, the changes were discussed in a very professional manner, all (at the time available) protocols were followed, and a calm and deliberate reasoning was given. Being terse and (arguably) rude to companies over their using tools he contributed to does not constitute the action being trollish. Sure, I'm sure you could argue Adolf was a pretty cool guy if you ignore all the other stuff he did and just focus on his gun control policy. ”¥"
165,670572986,uncivil,This is really frustrating,563358419,technical,For what it's worth I am using WinAppDriver in a production environment to do Robotic Process Automation (RPA) Validation of application availability.  Developer Mode has been identified by our security team as a no no.  It's a show stopper.  Why FORCE developer mode?,For what it's worth I am using WinAppDriver in a production environment to do Robotic Process Automation (RPA) Validation of application availability.  Developer Mode has been identified by our security team as a no no.  It's a show stopper.  Why FORCE developer mode? This is really frustrating
165,742975256,uncivil,This is stupid!,670572986,uncivil,This is really frustrating,This is really frustrating This is stupid!
17452,469614983,uncivil,Did you actually read the thread?,469613053,technical,If the above fixes don't work try this (worked on Fedora 29) add: export to the end of your bashrc.  You will need to open a new terminal or log out/in,If the above fixes don't work try this (worked on Fedora 29) add: export to the end of your bashrc.  You will need to open a new terminal or log out/in Did you actually read the thread?
17452,472505912,uncivil,"The problem is nbot the ability to permanently remove files, please the first message of the issue... It's explicit.",472502936,civil,"If I'm misunderstanding what is being requested here, please let me know.","If I'm misunderstanding what is being requested here, please let me know. The problem is nbot the ability to permanently remove files, please the first message of the issue... It's explicit."
17452,472520611,uncivil,You assumed the most common error was because `gvfs-trash` was not installed.,472519112,technical,"This is the standard approach used by most software when confronted with the ""trash unavailability"" problem. If you want to be absolutely sure, put a delay on the dialog or a check box ""I really want to delete this file and understand the risks.","This is the standard approach used by most software when confronted with the ""trash unavailability"" problem. If you want to be absolutely sure, put a delay on the dialog or a check box ""I really want to delete this file and understand the risks. You assumed the most common error was because `gvfs-trash` was not installed."
17452,472520611,uncivil,"This thread is the proof it's no more the case. Please, update.",472519112,technical,"This is the standard approach used by most software when confronted with the ""trash unavailability"" problem. If you want to be absolutely sure, put a delay on the dialog or a check box ""I really want to delete this file and understand the risks.","This is the standard approach used by most software when confronted with the ""trash unavailability"" problem. If you want to be absolutely sure, put a delay on the dialog or a check box ""I really want to delete this file and understand the risks. This thread is the proof it's no more the case. Please, update."
17452,485174468,uncivil,I would direct people to actually read the bug report before commenting.,485163337,technical,"Installing the flatpak version worked for me as well (Fedora 29). It is a solution, although installing via flatpak means giving up CLI tools.","Installing the flatpak version worked for me as well (Fedora 29). It is a solution, although installing via flatpak means giving up CLI tools. I would direct people to actually read the bug report before commenting."
17882,552056351,uncivil,Well great let me just ship your computer around so everyone can use it.,552050146,technical,"of course you could just create un-indexed buffer geometry to begin with, and not use ExplodeModifier or convert geometries otherwise. well, you know, a bunch of IF-s in the shader that almost noone would need any way... so, probably not. no flicker here at all","of course you could just create un-indexed buffer geometry to begin with, and not use ExplodeModifier or convert geometries otherwise. well, you know, a bunch of IF-s in the shader that almost noone would need any way... so, probably not. no flicker here at all Well great let me just ship your computer around so everyone can use it."
17882,552056351,uncivil,Or even better we will buy everyone a plane ticket and then can come stand in line to use your computer where the software does work.,552050146,technical,"of course you could just create un-indexed buffer geometry to begin with, and not use ExplodeModifier or convert geometries otherwise. well, you know, a bunch of IF-s in the shader that almost noone would need any way... so, probably not. no flicker here at all","of course you could just create un-indexed buffer geometry to begin with, and not use ExplodeModifier or convert geometries otherwise. well, you know, a bunch of IF-s in the shader that almost noone would need any way... so, probably not. no flicker here at all Or even better we will buy everyone a plane ticket and then can come stand in line to use your computer where the software does work."
1818,665669513,uncivil,"I dont understand why people working for google have such a problem admting they make mistakes...  everybody does, what makes difference is fix them or not.",665235918,technical,"I think ashwinraghav explained this pretty well! We support a JSON REST API since that's a common standard for REST APIs on the web, and XML defaults on Android since that's the standard for the platform. I understand there can be frustration working between the formats.  You should only need to define RC in-app defaults once though - in the XML file. The default values saved online and available through the REST API are the server-side defaults used when no condition is met. There's more documentation on how Remote Config prioritizes parameter values in the docs here","I think ashwinraghav explained this pretty well! We support a JSON REST API since that's a common standard for REST APIs on the web, and XML defaults on Android since that's the standard for the platform. I understand there can be frustration working between the formats.  You should only need to define RC in-app defaults once though - in the XML file. The default values saved online and available through the REST API are the server-side defaults used when no condition is met. There's more documentation on how Remote Config prioritizes parameter values in the docs here I dont understand why people working for google have such a problem admting they make mistakes...  everybody does, what makes difference is fix them or not."
1818,665669513,uncivil,"i cant even imagine a meeting to present the product: Here we have a new tool that will allow developers to set constants remotelly, helping with A/B tests and allowing the developer to change apps behavior without re-deploy.""",665235918,technical,"I think ashwinraghav explained this pretty well! We support a JSON REST API since that's a common standard for REST APIs on the web, and XML defaults on Android since that's the standard for the platform. I understand there can be frustration working between the formats.  You should only need to define RC in-app defaults once though - in the XML file. The default values saved online and available through the REST API are the server-side defaults used when no condition is met. There's more documentation on how Remote Config prioritizes parameter values in the docs here","I think ashwinraghav explained this pretty well! We support a JSON REST API since that's a common standard for REST APIs on the web, and XML defaults on Android since that's the standard for the platform. I understand there can be frustration working between the formats.  You should only need to define RC in-app defaults once though - in the XML file. The default values saved online and available through the REST API are the server-side defaults used when no condition is met. There's more documentation on how Remote Config prioritizes parameter values in the docs here i cant even imagine a meeting to present the product: Here we have a new tool that will allow developers to set constants remotelly, helping with A/B tests and allowing the developer to change apps behavior without re-deploy."""
1818,665669513,uncivil,You just told me that if someone has an app in both architectures and want to use the default values THIS PERSON MUST DEFINE EVERY FIELD 3 TIMES... does it sound smart?,665235918,technical,"I think ashwinraghav explained this pretty well! We support a JSON REST API since that's a common standard for REST APIs on the web, and XML defaults on Android since that's the standard for the platform. I understand there can be frustration working between the formats.  You should only need to define RC in-app defaults once though - in the XML file. The default values saved online and available through the REST API are the server-side defaults used when no condition is met. There's more documentation on how Remote Config prioritizes parameter values in the docs here","I think ashwinraghav explained this pretty well! We support a JSON REST API since that's a common standard for REST APIs on the web, and XML defaults on Android since that's the standard for the platform. I understand there can be frustration working between the formats.  You should only need to define RC in-app defaults once though - in the XML file. The default values saved online and available through the REST API are the server-side defaults used when no condition is met. There's more documentation on how Remote Config prioritizes parameter values in the docs here You just told me that if someone has an app in both architectures and want to use the default values THIS PERSON MUST DEFINE EVERY FIELD 3 TIMES... does it sound smart?"
1818,665669513,uncivil,"I hate to be rude and also hate to teach people how to do their jobs. but this architecture design of firebase RC is a clear mistake, anyone with a basic software engineer understand should be able to see that.",665235918,technical,"I think ashwinraghav explained this pretty well! We support a JSON REST API since that's a common standard for REST APIs on the web, and XML defaults on Android since that's the standard for the platform. I understand there can be frustration working between the formats.  You should only need to define RC in-app defaults once though - in the XML file. The default values saved online and available through the REST API are the server-side defaults used when no condition is met. There's more documentation on how Remote Config prioritizes parameter values in the docs here","I think ashwinraghav explained this pretty well! We support a JSON REST API since that's a common standard for REST APIs on the web, and XML defaults on Android since that's the standard for the platform. I understand there can be frustration working between the formats.  You should only need to define RC in-app defaults once though - in the XML file. The default values saved online and available through the REST API are the server-side defaults used when no condition is met. There's more documentation on how Remote Config prioritizes parameter values in the docs here I hate to be rude and also hate to teach people how to do their jobs. but this architecture design of firebase RC is a clear mistake, anyone with a basic software engineer understand should be able to see that."
1818,665669513,uncivil,"I'm sorry to tell you but this isnt frustrating"" this is a super stupid architecture design...""",665235918,technical,"I think ashwinraghav explained this pretty well! We support a JSON REST API since that's a common standard for REST APIs on the web, and XML defaults on Android since that's the standard for the platform. I understand there can be frustration working between the formats.  You should only need to define RC in-app defaults once though - in the XML file. The default values saved online and available through the REST API are the server-side defaults used when no condition is met. There's more documentation on how Remote Config prioritizes parameter values in the docs here","I think ashwinraghav explained this pretty well! We support a JSON REST API since that's a common standard for REST APIs on the web, and XML defaults on Android since that's the standard for the platform. I understand there can be frustration working between the formats.  You should only need to define RC in-app defaults once though - in the XML file. The default values saved online and available through the REST API are the server-side defaults used when no condition is met. There's more documentation on how Remote Config prioritizes parameter values in the docs here I'm sorry to tell you but this isnt frustrating"" this is a super stupid architecture design..."""
