email_id,comment_id,comment_code,comment_body,previous_comment_id,previous_comment_code,previous_comment_body,concat_body
10132,395207602,uncivil,"I think, you have many professional developers and why this F... RTL problem is not important for you?",395202192,technical,This issue should be fixed.,"This issue should be fixed. I think, you have many professional developers and why this F... RTL problem is not important for you?"
10132,395207602,uncivil,Why atom team don't like to fix this issue?,395202192,technical,This issue should be fixed.,This issue should be fixed. Why atom team don't like to fix this issue?
102,102,uncivil,Microsoft products are phenomenally bad and it's a wonder how you guys still stay in business.,571274865,uncivil,"Telling us you are frustrated is fine, ranting is not.","Telling us you are frustrated is fine, ranting is not. Microsoft products are phenomenally bad and it's a wonder how you guys still stay in business."
102,102,uncivil,Microsoft products are phenomenally bad and it's a wonder how you guys still stay in business.,571274865,-1,,Microsoft products are phenomenally bad and it's a wonder how you guys still stay in business.
102,102,uncivil,I suspect your whiteboarding hiring technique is ineffective and counterproductive.,571274865,uncivil,"Telling us you are frustrated is fine, ranting is not.","Telling us you are frustrated is fine, ranting is not. I suspect your whiteboarding hiring technique is ineffective and counterproductive."
102,102,uncivil,I suspect your whiteboarding hiring technique is ineffective and counterproductive.,571274865,-1,,I suspect your whiteboarding hiring technique is ineffective and counterproductive.
102,102,uncivil,What's so special about installing .NET Core that it requires a different installation strategy?,571274865,uncivil,"Telling us you are frustrated is fine, ranting is not.","Telling us you are frustrated is fine, ranting is not. What's so special about installing .NET Core that it requires a different installation strategy?"
102,102,uncivil,What's so special about installing .NET Core that it requires a different installation strategy?,571274865,-1,,What's so special about installing .NET Core that it requires a different installation strategy?
102,102,uncivil,GET YOUR ACT TOGETHER MICROSOFT!!!!,571274865,uncivil,"Telling us you are frustrated is fine, ranting is not.","Telling us you are frustrated is fine, ranting is not. GET YOUR ACT TOGETHER MICROSOFT!!!!"
102,102,uncivil,GET YOUR ACT TOGETHER MICROSOFT!!!!,571274865,-1,,GET YOUR ACT TOGETHER MICROSOFT!!!!
102,102,uncivil,"If I sound harsh, it's because I am sick and tired of Microsoft releasing half-baked products that don't work as expected.",571274865,uncivil,"Telling us you are frustrated is fine, ranting is not.","Telling us you are frustrated is fine, ranting is not. If I sound harsh, it's because I am sick and tired of Microsoft releasing half-baked products that don't work as expected."
102,102,uncivil,"If I sound harsh, it's because I am sick and tired of Microsoft releasing half-baked products that don't work as expected.",571274865,-1,,"If I sound harsh, it's because I am sick and tired of Microsoft releasing half-baked products that don't work as expected."
102,102,uncivil,"I would feel sorry for you guys like I would for the slow kid who klutzes around the basketball court, but this isn't your first time on the court with years of effort and tons of resources.",571274865,uncivil,"Telling us you are frustrated is fine, ranting is not.","Telling us you are frustrated is fine, ranting is not. I would feel sorry for you guys like I would for the slow kid who klutzes around the basketball court, but this isn't your first time on the court with years of effort and tons of resources."
102,102,uncivil,"I would feel sorry for you guys like I would for the slow kid who klutzes around the basketball court, but this isn't your first time on the court with years of effort and tons of resources.",571274865,-1,,"I would feel sorry for you guys like I would for the slow kid who klutzes around the basketball court, but this isn't your first time on the court with years of effort and tons of resources."
102,102,uncivil,It's why your own developers are using MacBook Pros for development.,571274865,uncivil,"Telling us you are frustrated is fine, ranting is not.","Telling us you are frustrated is fine, ranting is not. It's why your own developers are using MacBook Pros for development."
102,102,uncivil,It's why your own developers are using MacBook Pros for development.,571274865,-1,,It's why your own developers are using MacBook Pros for development.
1511,663869330,uncivil,WTF?,504873945,technical,#755 has ctrl backspace in the title and probably came up in the suggestion box when you added this issue. Please make sure you search before reporting.,#755 has ctrl backspace in the title and probably came up in the suggestion box when you added this issue. Please make sure you search before reporting. WTF?
102513,659320113,uncivil,This is the kind of coding quality we get when corporations prioritizes employee diversity over code quality,658991277,technical,"Ah, so there's some proprietary software that VSCode uses that apparently does something which can lead to a security hole. We don't know what it does or how risky it is to run.","Ah, so there's some proprietary software that VSCode uses that apparently does something which can lead to a security hole. We don't know what it does or how risky it is to run. This is the kind of coding quality we get when corporations prioritizes employee diversity over code quality"
102513,659431435,uncivil,A thumbs down isn't enough on this one. There's zero tolerance for backwater attitude. Reporting.,659320113,uncivil,This is the kind of coding quality we get when corporations prioritizes employee diversity over code quality,This is the kind of coding quality we get when corporations prioritizes employee diversity over code quality A thumbs down isn't enough on this one. There's zero tolerance for backwater attitude. Reporting.
10260,166937573,uncivil,If people like me and you don't attempt it then we can wait another 3 years without anyone else picking the issue up.,166933212,civil,I would like to help .. just don't think I have the needed skills.,I would like to help .. just don't think I have the needed skills. If people like me and you don't attempt it then we can wait another 3 years without anyone else picking the issue up.
10260,175131660,uncivil,I am frankly fed up with this posture in open source projects.,175125233,technical,"We are looking at how to integrate a non-supported and non-tested platform into the bleeding-edge tree without adding an undue burden on the mainline development. The current plan is that only officially supported platforms are going to be maintained by the Dart team in general. This means that for example any of the BSD ports can and will likely break often as we rely on new OS features or make changes to the OS dependent APIs.  To reduce the maintenance effort for the supported platforms, we will likely need that all of the BSD variants (Open, Free, Net) coexist in a single set of xyz bsd.cc and h files. As you may have noticed the OP is about supporting the Dart VM on FreeBSD, but the current code review is for OpenBSD. So we know that we have interest in at least two of the variants.  Thank you for your continued patience.","We are looking at how to integrate a non-supported and non-tested platform into the bleeding-edge tree without adding an undue burden on the mainline development. The current plan is that only officially supported platforms are going to be maintained by the Dart team in general. This means that for example any of the BSD ports can and will likely break often as we rely on new OS features or make changes to the OS dependent APIs.  To reduce the maintenance effort for the supported platforms, we will likely need that all of the BSD variants (Open, Free, Net) coexist in a single set of xyz bsd.cc and h files. As you may have noticed the OP is about supporting the Dart VM on FreeBSD, but the current code review is for OpenBSD. So we know that we have interest in at least two of the variants.  Thank you for your continued patience. I am frankly fed up with this posture in open source projects."
10260,296791437,uncivil,I've abandoned (a long time ago) the port effort and don't even use Dart anymore and will stop watching this rep.,294295396,technical,"I have some suggestions on maintaining clear separation between the hosts that the Dart team ships periodically and ones that are supported by the community:  - Add the separation via the build system so that the build step that you use to build the install ready binaries does not by default build binaries for non-supported hosts. - Keep the files ending with  openbsd.cc and  openbsd.h in the source directory (if you don't want to see the OpenBSD files in the bin/runtime directory for whatever reason, consider moving the host specific files into a single separate directory for host-specific code or to multiple separate directories based on what is being specialized for each host). - Add disclaimers on each of the files that are specific to non-supported hosts explaining that these hosts are not being supported directly by Google and that the Dart SDK is only available on these hosts because of generous contributions from people from the community who spent their limited time porting the Dart SDK to a new host so that they could enable the usage of the Dart SDK on that host for the benevolence of the Dart community.  I also think it's unreasonable ask mulander to add support for all of the BSD operating systems in one set of files ending in  bsd.cc and bsd.hh as mulander would have to then add support for at least two different operating systems which is quite extreme (show some empathy and think about the human cost (in terms of time and effort) that would be required to learn about all the different BSD operating systems and then validating and testing the code on a few of the major BSD operating systems just to get the work that was already done for OpenBSD merged upstream).","I have some suggestions on maintaining clear separation between the hosts that the Dart team ships periodically and ones that are supported by the community:  - Add the separation via the build system so that the build step that you use to build the install ready binaries does not by default build binaries for non-supported hosts. - Keep the files ending with  openbsd.cc and  openbsd.h in the source directory (if you don't want to see the OpenBSD files in the bin/runtime directory for whatever reason, consider moving the host specific files into a single separate directory for host-specific code or to multiple separate directories based on what is being specialized for each host). - Add disclaimers on each of the files that are specific to non-supported hosts explaining that these hosts are not being supported directly by Google and that the Dart SDK is only available on these hosts because of generous contributions from people from the community who spent their limited time porting the Dart SDK to a new host so that they could enable the usage of the Dart SDK on that host for the benevolence of the Dart community.  I also think it's unreasonable ask mulander to add support for all of the BSD operating systems in one set of files ending in  bsd.cc and bsd.hh as mulander would have to then add support for at least two different operating systems which is quite extreme (show some empathy and think about the human cost (in terms of time and effort) that would be required to learn about all the different BSD operating systems and then validating and testing the code on a few of the major BSD operating systems just to get the work that was already done for OpenBSD merged upstream). I've abandoned (a long time ago) the port effort and don't even use Dart anymore and will stop watching this rep."
10424,485117414,uncivil,Why would I post this on the community site? I'm experiencing this problem on the travis-ci.com website??,485114185,technical,Please post here instead. Thank you!,Please post here instead. Thank you! Why would I post this on the community site? I'm experiencing this problem on the travis-ci.com website??
10462,598364042,uncivil,you are showing how unappreciative and ignorant you can be.,595251053,technical,three years is nothing in terraform time,three years is nothing in terraform time you are showing how unappreciative and ignorant you can be.
10462,598364042,uncivil,"You can fault the devs for not getting this right with modules from the start, but aside from that, you should have more awareness of reality and what these changes have required before sharing those types of crass comments.",595251053,technical,three years is nothing in terraform time,"three years is nothing in terraform time You can fault the devs for not getting this right with modules from the start, but aside from that, you should have more awareness of reality and what these changes have required before sharing those types of crass comments."
10462,598364042,uncivil,"In fact, you should probably not use any open source software, as the type of comment you left above are one of the major reasons why application developers give up on open source.",595251053,technical,three years is nothing in terraform time,"three years is nothing in terraform time In fact, you should probably not use any open source software, as the type of comment you left above are one of the major reasons why application developers give up on open source."
10462,598375439,uncivil,Just because the software is open source doesn't mean we aren't paying for it.,598364042,uncivil,you are showing how unappreciative and ignorant you can be.,you are showing how unappreciative and ignorant you can be. Just because the software is open source doesn't mean we aren't paying for it.
10462,598375439,uncivil,Just because the software is open source doesn't mean we aren't paying for it.,598364042,uncivil,"You can fault the devs for not getting this right with modules from the start, but aside from that, you should have more awareness of reality and what these changes have required before sharing those types of crass comments.","You can fault the devs for not getting this right with modules from the start, but aside from that, you should have more awareness of reality and what these changes have required before sharing those types of crass comments. Just because the software is open source doesn't mean we aren't paying for it."
10462,598375439,uncivil,Just because the software is open source doesn't mean we aren't paying for it.,598364042,uncivil,"In fact, you should probably not use any open source software, as the type of comment you left above are one of the major reasons why application developers give up on open source.","In fact, you should probably not use any open source software, as the type of comment you left above are one of the major reasons why application developers give up on open source. Just because the software is open source doesn't mean we aren't paying for it."
109,792220411,uncivil,I honestly cannot believe how casual and dismissive you guys at MS are.,792215476,technical,Quote the blog post to me one more time.,Quote the blog post to me one more time. I honestly cannot believe how casual and dismissive you guys at MS are.
109,792220411,uncivil,I understand it must really difficult to do your job as a $1.75T company but can you try?,792215476,technical,Quote the blog post to me one more time.,Quote the blog post to me one more time. I understand it must really difficult to do your job as a $1.75T company but can you try?
11235,11235,uncivil,"Seeing you are happy to close issues and never respond to replies in closed issues, I am forced to open new issue.",561809857,uncivil,"I would like to remind you that we are a small team of maintainers, and it has been less than or barely 24 hours since I responded to your issue yesterday.","I would like to remind you that we are a small team of maintainers, and it has been less than or barely 24 hours since I responded to your issue yesterday. Seeing you are happy to close issues and never respond to replies in closed issues, I am forced to open new issue."
11235,11235,uncivil,"Seeing you are happy to close issues and never respond to replies in closed issues, I am forced to open new issue.",561809857,-1,,"Seeing you are happy to close issues and never respond to replies in closed issues, I am forced to open new issue."
11609,11609,uncivil,Telling users that they can use DSX but can't use debugger or enjoy auto-complete is a non starter for me.,409440643,technical,"Ok this conversation has gone well beyond the kinds of discussions that we consider acceptable in the Flutter community, and so I'm going to lock this thread and close the bug. Please consider reading for more details on how we behave here.  The next step if anyone wants to contribute code to address this issue would be to come up with a design for how to do build system integration such that we can have code generation work with Gradle, Xcode, hot reload, and integration with existing apps. If anyone is interested in working on this, please don't hesitate to reach out to me. Otherwise I expect this is something we'll work on early next year. Once we have a mechanism to do that, solutions like DSX will be easy to integrate into the Flutter ecosystem. We may even find solutions that should be integrated by default. In the meantime we're also working on improvements to Dart's syntax to see if we can make UI expressions even easier to write.  I would like to ask that people do not open new bugs on this topic unless there is something very constructive and new that is worth bringing up.","Ok this conversation has gone well beyond the kinds of discussions that we consider acceptable in the Flutter community, and so I'm going to lock this thread and close the bug. Please consider reading for more details on how we behave here.  The next step if anyone wants to contribute code to address this issue would be to come up with a design for how to do build system integration such that we can have code generation work with Gradle, Xcode, hot reload, and integration with existing apps. If anyone is interested in working on this, please don't hesitate to reach out to me. Otherwise I expect this is something we'll work on early next year. Once we have a mechanism to do that, solutions like DSX will be easy to integrate into the Flutter ecosystem. We may even find solutions that should be integrated by default. In the meantime we're also working on improvements to Dart's syntax to see if we can make UI expressions even easier to write.  I would like to ask that people do not open new bugs on this topic unless there is something very constructive and new that is worth bringing up. Telling users that they can use DSX but can't use debugger or enjoy auto-complete is a non starter for me."
11609,322844427,uncivil,"you are mixing everything I say and this conversation is going nowhere. In legal terms you are Badgering the witness"".""",322606129,civil,Sorry if I sound defensive or aggressive. :-),"Sorry if I sound defensive or aggressive. :-) you are mixing everything I say and this conversation is going nowhere. In legal terms you are Badgering the witness""."""
11609,322844427,uncivil,"you are mixing everything I say and this conversation is going nowhere. In legal terms you are Badgering the witness"".""",322606129,civil,"don't take my argumentative tone as dismissive, I'm very interested in your input here.","don't take my argumentative tone as dismissive, I'm very interested in your input here. you are mixing everything I say and this conversation is going nowhere. In legal terms you are Badgering the witness""."""
11609,322844427,uncivil,I just don't have the time for this here.,322606129,civil,Sorry if I sound defensive or aggressive. :-),Sorry if I sound defensive or aggressive. :-) I just don't have the time for this here.
11609,322844427,uncivil,I just don't have the time for this here.,322606129,civil,"don't take my argumentative tone as dismissive, I'm very interested in your input here.","don't take my argumentative tone as dismissive, I'm very interested in your input here. I just don't have the time for this here."
11609,322844427,uncivil,You failed to grasp that XML parsing (with some extra code to skip '{}' properly) is orders of magnitude simpler than fully parsing a programming language like Dart.,322606129,civil,Sorry if I sound defensive or aggressive. :-),Sorry if I sound defensive or aggressive. :-) You failed to grasp that XML parsing (with some extra code to skip '{}' properly) is orders of magnitude simpler than fully parsing a programming language like Dart.
11609,322844427,uncivil,You failed to grasp that XML parsing (with some extra code to skip '{}' properly) is orders of magnitude simpler than fully parsing a programming language like Dart.,322606129,civil,"don't take my argumentative tone as dismissive, I'm very interested in your input here.","don't take my argumentative tone as dismissive, I'm very interested in your input here. You failed to grasp that XML parsing (with some extra code to skip '{}' properly) is orders of magnitude simpler than fully parsing a programming language like Dart."
11609,351081596,uncivil,you should invest you time and energy in writing up convincing arguments.,351066144,technical,"What is your previous experience with JSX, have you really used it or just looked at it? I think you guys are underestimating JSX by saying it will give small gains here and there. If you don't have any users, you don't have a product.","What is your previous experience with JSX, have you really used it or just looked at it? I think you guys are underestimating JSX by saying it will give small gains here and there. If you don't have any users, you don't have a product. you should invest you time and energy in writing up convincing arguments."
11609,351097172,uncivil,"You guys are suffering from NIH syndrome (Not-invented-here). Good artists copy, great artists steal"", mediocre artists, well, behave like you.""",351081596,uncivil,you should invest you time and energy in writing up convincing arguments.,"you should invest you time and energy in writing up convincing arguments. You guys are suffering from NIH syndrome (Not-invented-here). Good artists copy, great artists steal"", mediocre artists, well, behave like you."""
11609,351097172,uncivil,"Really !!! nobody seems to bother to explain what exactly Flutter would gain... blah blah blah"".""",351081596,uncivil,you should invest you time and energy in writing up convincing arguments.,"you should invest you time and energy in writing up convincing arguments. Really !!! nobody seems to bother to explain what exactly Flutter would gain... blah blah blah""."""
11609,387752449,uncivil,"I don't want to argue against the feature but comments like if you don't do x then horribly y will happen"" are just ridiculous.""",387746356,technical,"When sorted by 'upvote', this feature request is listed 7th on the list of 3131 opened tickets though.","When sorted by 'upvote', this feature request is listed 7th on the list of 3131 opened tickets though. I don't want to argue against the feature but comments like if you don't do x then horribly y will happen"" are just ridiculous."""
