thread_id,email_id,quotation,quotation_code,email_final_code
391895,397649,"There's only one CPU (the leader) making the scheduling decision for that runqueue and if another CPU needs to modify the runqueue, it works like it does for CPU runqueues as well: the other CPU works with the leader's time.",neutral,civil
467091,471458,"I'm just pointing out that, if we have to expose I3C devices, we should look at what other discoverable buses do (PCI, USB, ...), not what I2C does.",neutral,civil
170193,188745,Creative commons?,neutral,civil
391895,397649,Hence my counter suggestion in the form of this patch set: Integrated into a general purpose scheduler  no need to partition off a part of the system  not tied to just VM use cases.,neutral,civil
169133,193114,"Hi, David:  How  do you think my patch?",neutral,civil
402510,414000,It's not like there is or isn't a security risk and that you can say that it is or it isn't in a global way.,neutral,civil
498594,576302,"That may be confusing for people familiar with other architectures, which may not have such bit.",neutral,civil
266279,266334,Further analysis is required as it seems all  these are False Positives.,neutral,civil
431048,432750,Or am I still not communicating well enough?,neutral,civil
166193,168161,I didn't get any response to a comment I've written about the point above during the previous patch iteration:> The old code set this bit in any mode other than AC'97 (where the  Maciej,neutral,civil
245912,245922,Or the peci command failed.,neutral,civil
391895,397649,It is not shared per se.,neutral,civil
174463,174508,Ok.,neutral,civil
402510,413768,Thanks!,neutral,civil
266918,267111,"Finally, make this a true patch series.",neutral,civil
281311,281957,Which is the case?,neutral,civil
245912,245953,We have a framework for doing clocks in the kernel.,neutral,civil
402510,413778,Guessing my reasonings has nothing to do with you mentioning incompentent sysadmins.,neutral,civil
245912,245953,The same comment applies to the other optional properties below.,neutral,civil
467091,471458,"I'm not saying I3C == USB, I'm just saying that the way you interact with an I3C from a SW PoV is not at all the same as you would do for an I2C device.",neutral,civil
289026,292549,I would not add more on top unless there is a _really_ strong usecase behind.,neutral,civil
245912,245922,More duplicate code.,neutral,civil
431048,432750,It does not specify in what cases the email address can be published.,neutral,civil
245912,245953,"It looks like you've done some kind of review that we weren't allowed to see, which is a double edged sword - I might be asking about things that you've already spoken about with someone else.",neutral,civil
541450,544269,What a complete mess we have here.,neutral,civil
467091,471458,"The question is not whether I3C will replace I2C or USB, of course it's meant to overcome the limitations of I2C.",neutral,civil
365796,367764,"Dan,    It is better do add some complexity to the driver than to the user configurable settings like DT.",neutral,civil
571417,571702,Please excuse my brevity.,neutral,civil
482005,482038,Note that this patch does *not* remove the nasty trap caused by the garbage in question - struct file can be freed before we even return from ->unlocked_ioctl().,neutral,civil
498594,590551,"Most of them use the PRESENT bit naming convention, just a few use VALID.",neutral,civil
152625,156564,How do you plan to handle the external references?,neutral,civil
245912,245922,Why ?,neutral,civil
210458,210461,A: Top-posting.,neutral,civil
377230,377461,"Yes, but they are very rare and we don't really care about this in the slow path.",neutral,civil
541450,543076,Neil,neutral,civil
476403,478120,That's how computers work.,neutral,civil
391895,397649,That's fine.,neutral,civil
358863,358900,Quite possibly - inlining it,neutral,civil
391895,397649,"Of course, if you have a suggestion for a different locking scheme, we can discuss that as well.",neutral,civil
245912,245953,Could the above use regmap_read_poll_timeout instead?,neutral,civil
571417,571702,This is phenomenal.,neutral,civil
152625,156871,"IMO symlinks are mostly ending in a mess, URLs are never stable.",neutral,civil
383199,392690,"Ick, this is still messy, just try making this:  Yeah, it's over 80 columns, but it looks better and is easier to read, right?",neutral,civil
216128,216133,I can't find mention of amdcz in Linus's tree nor linux-next.,neutral,civil
266279,266313,"So, a quick look at the driver is enough to know exactly what the ioctl would answer.",neutral,civil
289431,289688,I'm fine with either approach.,neutral,civil
207400,207934,Basically a one port i2c mux.,neutral,civil
365796,367116,I racked my brain trying to figure out how to configure the control banks and associated LED strings.,neutral,civil
365796,367764,Besides - you will only need to check if given led-source is already taken by another node.,neutral,civil
152625,156871,There is a      to handle such requirements.,neutral,civil
498594,576302,"The Linux kernel contains a mitigation for this attack vector, PTE -   inversion, which is permanently enabled and has no performance -   impact.",neutral,civil
402510,413650,"This feature was requested by the exact opposite concern, that in order  to access the i915 PMU, one has to compromise the security of the entire  system by allowing access to *all* PMU's.",neutral,civil
498594,590551,If you want to provide more accurate documentation then you better come up with something which is helpful instead of completely useless blurb like the below:   How is the admin going to figure that out?,neutral,civil
307410,311549,"If you have a better way to fix this, I'd be glad to hear it.",neutral,civil
541450,543076,"If you have an application built against kernel (B), and uses structure fields that only exist in that version of the kernel (and not earlier) will fail to compile when built against kernel (A) headers, and thats expected.",neutral,civil
379138,379657,"I like the idea and I think it's good direction to go, but could you please share some from perf stat or whatever you used to meassure the new performance?",neutral,civil
402510,413698,Please look for the SECCOMP folks in MAINTAINERS.,neutral,civil
207400,207934,"The current mux code does not seem to directly allow it, since it calls i2c_transfer() directly on the parent, where as you want it to call your own i2c_transfer function.",neutral,civil
245912,245953,(This is the wait for the clock to be stable?),neutral,civil
180488,180837,"Sorry, I missed that.",neutral,civil
541450,541516,There probably is a decent compromise to find between not accepting a single additional byte and accepting several GB.,neutral,civil
399771,401526,"Do not pave the way for future bugs, make your code robust, please.",neutral,civil
377230,377461,This is a potential list corruption landmine because this function now has unbalanced list add and removal contexts.,neutral,civil
159308,177720,"Irrelevant-Nit: sys-regs usually have a 'SYS_' prefix, and are in instruction encoding order lower down the file.",neutral,civil
402510,413698,The keyword in the above sentence is 'just'.,neutral,civil
391895,397297,"All in all, I'm not inclined to consider this approach, it complicates an already overly complicated thing (cpu-cgroups) and has a ton of unresolved issues while at the same time it doesn't (and cannot) meet the goal it was made for.",neutral,civil
391895,397649,Bye bye interactivity.,neutral,civil
230843,231058,"In any case, if you insist, I can try to rework the whole stuff implementing module_finalize().",neutral,civil
467091,471458,"If there's a need for the latter, then we should start thinking about the slave framework...   Can you detail a bit more what you have in mind?",neutral,civil
221804,221853,return !!,neutral,civil
207400,208159,"understood - a much cleaner pattern   right - removed   yikes - thanks for catching that   ok   yes, that static arrays are not very forward-thinking and yes my arrays are not consistent.",neutral,civil
232313,234089,Maintainers don't mine mailing lists for patches to apply.,neutral,civil
391895,394633,"[This becomes relevant below] Specifically, all of the threads of qemu are in sub-cgroups, which do not indicate they are co-scheduling:  When I then try to coschedule the second VM, the machine hangs.",neutral,civil
245912,245953,We certainly don't want to print a message saying invalid,neutral,civil
202437,202446,Use normal patch styles.,neutral,civil
498594,590551,It's about the way the limit is determined on certain class of systems.,neutral,civil
258997,260177,[ it was posted two weeks ago and ACKed by me ],neutral,civil
303621,305468,I never said we were perfect reviewers.,neutral,civil
170193,188745,I just noticed a patch for checkpatch.pl about SPDX and asked the same question there.,neutral,civil
266918,269136,"I'll remember all this for the next time (if next time there is, of course, I was already quite hesitant to spend time to prepare and send patches for these issues with enum/integer mix-up).",neutral,civil
378505,378562,"does running mkfs.xfs -l size=2000m ... instead of using the default tiny log on your tiny test filesystem make the problem go away?""",neutral,civil
167856,174594,Doing this involves that I have to remove pinctrl nodes for the pins which are going to be request through the gpiolib to avoid conflicts.,neutral,civil
289026,292839,They just do not belong there.,neutral,civil
541450,543076,The application is passing in a buffer that is incompatible with what the running kernel expects.,neutral,civil
347183,349692,"Looking once more at the three stack traces you've provided, we've got: - output_poll_execute() stuck waiting for fb_helper->lock   which is held by drm_dp_mst_link_probe_work() - rpm_suspend() stuck waiting for output_poll_execute() to finish - drm_dp_mst_link_probe_work() stuck waiting in rpm_resume()  For the moment we can ignore the first task, i.e.",neutral,civil
431048,432750,Permission vs exclusion is orthogonal to my comments.,neutral,civil
539613,546377,Since when is the cover letter mandatory?,neutral,civil
498594,573986,What's advertisement there?,neutral,civil
170193,188751,Relatively significant?,neutral,civil
202437,513970,* Have you taken any other solution approaches into account than   a quick rejection?,neutral,civil
571417,571702,Thank you so much for digging into this.,neutral,civil
168169,173259,"Once we settle on the configuration parameter, I can give you my R-b :) ",neutral,civil
314071,314224,I will note that the FALLOC_FL_NO_HIDE_STALE flag is a bit controversial in linux-fsdevel.,neutral,civil
347183,349692,Sorry!,neutral,civil
307410,307390,Please disregard the second one.,neutral,civil
169133,193114,"As you see, think my patch is ok to be accepted.",neutral,civil
541450,544269,"Use new socket option numbers next time, do not change the size and/or layout of existing socket options.",neutral,civil
259276,259489,"After knowing this, I admit my patch is not proper, sorry...",neutral,civil
541450,543076,"Any time you make a system call to the kernel, you have to be prepared to handle the resulting error condition, thats not unexpected.",neutral,civil
347183,349692,This should have bumped the runtime PM refcount and have_disp_power_ref should be true.,neutral,civil
289431,289688,Note that __sync_blockdev will return errors based on the legacy AS_EIO/AS_ENOSPC flags.,neutral,civil
498594,576302,"For mitigation to be effective, physical memory needs +   to be limited in some configurations.",neutral,civil
202437,191275,We have got different preferences for a safe patch granularity.,neutral,civil
245912,245953,Do you want to put it behind some kind of conditional?,neutral,civil
266279,266331,I see I've missed some obvious things that you've pointed out here.,neutral,civil
431048,432750,ordinarily collected by the project is a much broader universe.,neutral,civil
424089,424518,"Certainly, byte-at-a-time is a pretty lame implementation when the addresses are suitably aligned.",neutral,civil
391895,397297,You pretty much have to dedicate a set of CPUs to just scheduling VMs with such a scheduler.,neutral,civil
221804,221853,Choose one of those two.,neutral,civil
336834,337316,You likely also infer about the order of consuming the locks based on the contents of the stack dump associated to each lock.,neutral,civil
431048,432750,The desired goal is to be able to publish email addresses in patch and commit tags.,neutral,civil
314071,314224,What the NO_HIDE_STALE flag does is allow a discard request for those block devices which do not have the DISCARD_ZEROES_DATA flag.,neutral,civil
498594,590551,Here is what you said:   Nice try.,neutral,civil
221804,221853,Better to keep in order.,neutral,civil
289026,271213,I will look for another way.,neutral,civil
476403,478120,"The kernel is not the place to try and abstract such stuff, C is our portable assembler.",neutral,civil
347183,349692,"BTW, drm_kms_helper_poll_disable() seems to be called twice in the runtime_suspend code path, once in nouveau_pmops_runtime_suspend() and a second time in nouveau_display_fini().",neutral,civil
402510,413698,What I was asking for is proper documentation and this proper documentation is meant for _competent_ sysadmins.,neutral,civil
307410,311549,But this should *not* be treated as a feature request.,neutral,civil
336834,337316,"I  confirm that in case of x86_64, the bss size is increased by ~1M [1] with standard v4.18-rc4 x86_64_defconfig + CONFIG_LOCKDEP.",neutral,civil
207400,207934,I would say this is done right.,neutral,civil
258997,259513,could you please illustrate me what the kconfig & warning is?,neutral,civil
347183,349692,"The same check seems necessary after flushing drm_dp_mst_link_probe_work(): If the work item lit up a new display, all previous suspend steps need to be unwound and -EBUSY needs to be returned to the PM core.",neutral,civil
202437,160227,Are you going to answer any of my remaining questions in a more constructive way?,neutral,civil
431048,432750,(This is the point of my original comment.),neutral,civil
541450,543076,"I would assert that an old program, within the constraints of the issue being discussed here, will run perfectly well, when built and run against a new kernel.",neutral,civil
391895,397649,Address them one by one.,neutral,civil
424089,424518,Which CPU architecture?,neutral,civil
336834,337316,"For sparc there seems to be a dedicated CONFIG_LOCKDEP_SMALL, which seems to downsize the lockdep implementation anyway.",neutral,civil
174735,199673,Why you want checks for something that not exist ?,neutral,civil
391895,397649,"As mentioned before, existing scheduler features, like preemption, (should) still work as before with this variant of coscheduling, with the same look and feel.",neutral,civil
222860,223021,Since when do U-Boot patches go to LKML and dri-devel?,neutral,civil
202437,191275,There are communication difficulties to consider since your terse information from your conference meeting.,neutral,civil
289026,292549,We really do not want to make the current hugetlb code more complex than it is already.,neutral,civil
303621,305468,It's not going away.,neutral,civil
174735,199701,"You implemented the same code thrice, it surely is not reduced.",neutral,civil
254985,255085,It is much more important to sort out the big picture first and only then deal with minor implementation details.,neutral,civil
402510,413650,Making this ability fine-grained sounds like a logical solution for  solving this weakening of security controls.,neutral,civil
391895,397297,"And then people will complain again that partitioning a system isn't dynamic enough and we need magic :/  (and this too would be tricky to virtualize itself)   You gloss over a ton of details here, many of which are non trivial and marked broken in your patches.",neutral,civil
254985,255085,You will have to be patient because this is a rather big change and it will take _quite_ some time to get sorted.,neutral,civil
391895,394633,"[ I am not subscribed to LKML, please keep me CC'd on replies ]    I tried a simple test with several VMs (in my initial test, I have 48 idle 1-cpu 512-mb VMs and 2 idle 2-cpu, 2-gb VMs) using libvirt, none pinned to any CPUs.",neutral,civil
498594,573990,"Malicious guest in a virtual machine    --  (english)  (cesky, pictures)",neutral,civil
365796,367764,In your bindings device configuration is scattered among global control-bank-cfg property and child node's reg property.,neutral,civil
498594,590551,What kind of systems might be affected by this?,neutral,civil
307410,349339,(Note: I do the majority of my testing in a looped-back setup).,neutral,civil
431048,432750,I'll add comments below to try to make more clear what I'm trying to say.,neutral,civil
245912,245953,"Actually, the entire for loop is cryptic.",neutral,civil
336834,337316,"Actually this only works for backtraces with common history, i.e.",neutral,civil
431048,432750,"The patch says Publishing ... electronic address not ordinarily collected by the project  without explicit permission"".""",neutral,civil
72369,470502,1-st level means its parent is root and so on.,neutral,civil
391895,397649,"(As opposed to a normal"" task group SE (TG-SE)  which represents just one runqueue in a different task group.)""",neutral,civil
254985,255085,The more versions you post the more fragmented and messy the discussion will become.,neutral,civil
402510,413768,"Even though I am not convinced the  bar to allow fine-grained control should be evaluating all possible  PMUs*, but if the security folks agree that is the case it is fine by me.",neutral,civil
467091,471421,I miss to mention PCI but since the beginning refer the slave and the  common part.,neutral,civil
306145,357688,So please don't.,neutral,civil
289026,294078,It would be greatly appreciated if you could mention why we can not charge surplus hugepages to memcg.,neutral,civil
259276,259299,"I also don't think we have the hrtimer machinery for usleep_range() to work properly on parisc, so I don't think the replacement works.",neutral,civil
391895,397649,"I agree, that this isn't ready to be merged.",neutral,civil
152625,156871,"I really like them, factually valuable comments .. please express your concern so that we have a chance to move on.",neutral,civil
336834,337035,"Yeah, not going to happen.",neutral,civil
498594,770007,Lying about security bugs being fixed when they are not is not cool.,neutral,civil
167856,174594,I will try to handle the ones related to the platforms I am using.,neutral,civil
174463,174508,Shouldn't there be a at least a comment to explain why zero is an appropriate initialization value in that case?,neutral,civil
207400,207934,How about writing an i2c bus driver which sits directly on top of another i2c bus?,neutral,civil
258997,259457,It's that simple.,neutral,civil
168169,173259,"For CG and PG, it would be a all-or-nothing (either boot values, or everything like nvidia).",neutral,civil
314071,314224,"However, the patches are out of tree, because pretty much all of the file system developers who work for enterpise distributions were against this functionality.",neutral,civil
365796,367764,"Your control-bank-cfg seemed like having much room for improvement, and it would for sure raise questions on why it was implemented that way.",neutral,civil
210458,210459,"That feels crazy, as for these calls we know it will never be NULL because the previous call to debugfs_file_get() will always ensure it will be correct.",neutral,civil
498594,590551,Numbers are irrelevant because that documentation has to be applicable for stable kernels as well.,neutral,civil
347183,348381,"To be honest, I had to double check this about literally 20 times to make sure I was actually understanding this issue correctly.",neutral,civil
402510,413778,I did not say that you mentioned google.,neutral,civil
202437,196318,I find such a change combination unsafe.,neutral,civil
498594,590551,The mitigation is available when the kernel provides it.,neutral,civil
391895,397649,So what?,neutral,civil
498594,576302,Ok.,neutral,civil
202437,191275,Or would you get frightened still by any other change combination?,neutral,civil
245912,245953,regmap imposes a number of pointer lookups and tests each time you do a read or write.,neutral,civil
281311,281957,"Either it does exist, or it doesn't.",neutral,civil
289026,294078,"When resize the pool, I think that the number of surplus hugepages in use does not change.",neutral,civil
245912,245953,I think just saying ASPEED PECI support is enough.,neutral,civil
289026,292549,Please make sure to describe such a usecase in details before we even start considering the code.,neutral,civil
346223,347267,And who *are* the people who are performing this configuration?,neutral,civil
314071,314224,"I have no idea how Darrick was able to get commit 25f4c41415e5 upstream, but I guess it was less controversial for block devices than for file systems.",neutral,civil
539613,546377,See git log tools/testing/selftests/,neutral,civil
498594,590551,No.,neutral,civil
476403,478120,"0 is false, 1 is true.",neutral,civil
266279,267299,"Ok, a poor man"" approach would be to pass the array directly to the core and let the implementation there to implement the array fetch logic  calling array_index_nospec() there  but I wonder if are there any other way that won't require too much code churn.""",neutral,civil
266279,266331,I'll  mark these warnings as False Positives and take your points into account  for the analysis of the rest of the Spectre issues reported by Smatch.,neutral,civil
173287,173288,You can't do it this simply as it will cause deadlock due to nested locking of the buf_lock.,neutral,civil
391895,397649,"That is, what I call intrusive.",neutral,civil
391895,397649,"Even if you're not inclined -- at this stage, if I may be so bold :) -- your feedback is valuable.",neutral,civil
365796,367116,These values are for the device configuration itself and the reg below indicates which control bank the LED node is assigned to.,neutral,civil
258997,260189,The init function is making sure cal_type is one or another.,neutral,civil
402510,413698,"I surely know a few which qualify for exclusion, so the right approach is to provide this knob only when the risk is analyzed and documented and the PMU has been flagged as candidate for unpriviledged exposure.",neutral,civil
402510,413650,"Hi, I accept it was by bad to miss adding Cc's on the cover letter, but my  own email addresses hopefully should not bother you.",neutral,civil
289026,292839,due to the pool resize.,neutral,civil
377230,377461,"You didn't convert that to use wake queues, and so that won't remove tickets for the grant head waiter list, and so those tasks will never get out of the new inner loop you added to xlog_grant_head_wait().",neutral,civil
258997,259457,"The code causes new compiler warnings, and the warnings are valid.",neutral,civil
346223,347267,If the latter then they presumably aren't easily confused!,neutral,civil
245912,245922,"FWIW, this should be two separate patches.",neutral,civil
391895,397649,This SD-SE represents the per CPU runqueues of this core of this task group.,neutral,civil
222860,223039,I'm going to be real disappointed if we see another fork get merged.,neutral,civil
391895,397649,It may *still* be beneficial for a use case.,neutral,civil
331266,331355,You normally have to manually initialize a dynamic attribute.,neutral,civil
402510,413778,And not having documentation is basically the same thing as telling them to use google.,neutral,civil
289026,292549,I believe we want to keep that status quo.,neutral,civil
391895,397649,Tasks are still only enqueued in the per CPU runqueues.,neutral,civil
391895,397297,"The existing cgroup overhead is significant, you also made that many times worse.",neutral,civil
467091,471458,"For the dual-role thing, maybe we can consider them as master (ones with advances slave features).",neutral,civil
467091,479249,That's what I'm complaining,neutral,civil
368515,368789,"I would like to see the following changes to your proposal:    - call it PERF_SAMPLE_DATA_PAGE_SIZE  That would allow two things:    1 - not tied to PERF_SAMPLE_ADDR    2 - Allow PERF_SAMPLE_CODE_PAGE_SIZE to be added  In some measurements, you may just care about the distribution of accesses across page sizes.",neutral,civil
541450,543076,"We could look into ways in which to detect the cases in which this might be 'ok', but I don't see why we should bother, because at some point its still an error to pass in an incompatible buffer.",neutral,civil
391895,397297,"I'll beg to differ, this isn't anywhere near something to consider merging.",neutral,civil
202437,513970,Does your wording indicate a questionable signal for further contributions?,neutral,civil
378505,379417,50GB is tiny for XFS.,neutral,civil
498594,576302,So how should it be called?,neutral,civil
467091,471458,They will come.,neutral,civil
365796,367764,It often obscures the issue.,neutral,civil
289026,292549,I am sorry that I didn't join the discussion for the previous version but time just didn't allow that.,neutral,civil
230843,231058,"If it's being called from FTRACE in run time, this would mean there were long calls in this module section, which in turn means, get_module_plt() was called at least once for this module and this section.",neutral,civil
391895,397649,"But, for example, you won't have group-based fairness between multiple kvm thingies.",neutral,civil
402510,413650,"Okay, for the next round I will expand the cover letter with at least  one concrete example on how it is usable and summarize the discussion a bit.",neutral,civil
